{
  "id": "pricing.enterprise",
  "type": "policy",
  "layer": "L3",
  "title": "Enterprise Pricing",
  "content": "Enterprise plans start at $2,500/month.\n",
  "content_type": "text/markdown",
  "authority": "canonical",
  "trust": "trusted",
  "owner": "sales",
  "status": "approved",
  "version": 3,
  "created": "2026-07-01T00:00:00Z",
  "updated": "2026-08-09T00:00:00Z",
  "valid_from": "2026-08-01T00:00:00Z",
  "expires": null,
  "durability": "long-lived",
  "classification": "internal",
  "permissions": {
    "read": [
      "sales-agent",
      "finance-agent"
    ],
    "write": [
      "sales-admin"
    ]
  },
  "sources": [
    {
      "uri": "crm://pricing/enterprise",
      "type": "canonical-record",
      "retrieved_at": "2026-08-09T15:00:00Z",
      "digest": "sha256:aaaaaaaaaaaaaaaaaaaaaaaaaaaaaaaaaaaaaaaaaaaaaaaaaaaaaaaaaaaaaaaa",
      "trust": "verified"
    }
  ],
  "supersedes": [
    "pricing.enterprise@2"
  ],
  "confidence": 1.0,
  "tags": [
    "pricing",
    "enterprise"
  ],
  "applies_to": [
    "sales"
  ],
  "references": [
    "policies.discounts"
  ],
  "approval": {
    "required": true,
    "roles": [
      "finance"
    ],
    "minimum": 1,
    "approved_by": [
      {
        "role": "finance",
        "id": "cfo@acme.example",
        "at": "2026-08-08T10:00:00Z"
      }
    ]
  },
  "review": {
    "interval": "180d",
    "next_review": "2027-02-09",
    "last_review": "2026-08-09"
  },
  "extensions": {
    "com.acme.risk": {
      "score": 0.25
    }
  }
}
